{
  "$schema": "https://json-schema.org/draft/2020-12/schema",
  "$id": "https://pfem.local/schemas/retention_terminal_permanent_public_register_verification_receipt.schema.json",
  "title": "PFEM Retention Terminal Permanent Public Register Verification Receipts",
  "type": "object",
  "required": [
    "retention_terminal_permanent_public_register_verification_receipt_id",
    "receipt_kind",
    "created_time",
    "node_id",
    "retention_terminal_permanent_public_register_record_id",
    "retention_terminal_permanent_custody_transfer_closeout_record_id",
    "verification_state",
    "checked_terminal_permanent_public_register_refs",
    "checked_subject_refs",
    "basis_refs",
    "digest_algorithm",
    "expected_terminal_permanent_public_register_ref_digest",
    "actual_terminal_permanent_public_register_ref_digest",
    "verified_by_ref",
    "summary"
  ],
  "properties": {
    "retention_terminal_permanent_public_register_verification_receipt_id": {
      "type": "string"
    },
    "receipt_kind": {
      "type": "string"
    },
    "created_time": {
      "type": "string"
    },
    "node_id": {
      "type": "string"
    },
    "retention_terminal_permanent_public_register_record_id": {
      "type": "string"
    },
    "retention_terminal_permanent_custody_transfer_closeout_record_id": {
      "type": "string"
    },
    "verification_state": {
      "type": "string"
    },
    "checked_terminal_permanent_public_register_refs": {
      "type": "array"
    },
    "checked_subject_refs": {
      "type": "array"
    },
    "missing_refs": {
      "type": "array"
    },
    "basis_refs": {
      "type": "array"
    },
    "digest_algorithm": {
      "type": "string"
    },
    "expected_terminal_permanent_public_register_ref_digest": {
      "type": "string"
    },
    "actual_terminal_permanent_public_register_ref_digest": {
      "type": "string"
    },
    "verified_by_ref": {
      "type": "string"
    },
    "summary": {
      "type": "string"
    }
  },
  "additionalProperties": true
}
